<?xml version="1.0" encoding="UTF-8" standalone="no"?>

<model xmlns="http://dev.meisen.net/xsd/dissertation/model"
       xmlns:xsi="http://www.w3.org/2001/XMLSchema-instance"
       xsi:schemaLocation="http://dev.meisen.net/xsd/dissertation/model http://dev.meisen.net/xsd/dissertation/tidaModel.xsd">

  <meta>
    <resources>
      <resource id="R1" name="person" />
      <resource id="R2" name="toy" />
    </resources>
    <descriptors>
      <descriptor id="D1" name="funFactor" dataType="java.lang.String" />
      <descriptor id="D2" name="smiles" dataType="java.lang.Integer" />
    </descriptors>
  </meta>
  
  <interval />
</model>