<?xml version="1.0" encoding="UTF-8" standalone="no"?>

<model xmlns="http://dev.meisen.net/xsd/dissertation/model"
       xmlns:xsi="http://www.w3.org/2001/XMLSchema-instance"
       xsi:schemaLocation="http://dev.meisen.net/xsd/dissertation/model http://dev.meisen.net/xsd/dissertation/tidaModel.xsd"
       id="myModel" name="My wonderful Model">

  <config>
    <factories>
      <!-- Define the factory to be used to determine which IndexedCollectionFactory
           to be used.
           
           The following factories are available by default:
            + net.meisen.dissertation.data.impl.indexes.IndexedCollectionFactory
        -->
      <indexes implementation="net.meisen.dissertation.data.impl.indexes.IndexedCollectionFactory" />

      <!-- Define the factory used for the resources, available are.
           
           The following factories are available by default:
            + net.meisen.dissertation.data.impl.resources.ResourcesFactory
            
           As identifier-factory the following implementations are available:
            + net.meisen.dissertation.data.impl.idfactories.IntegerIdsFactory
            + net.meisen.dissertation.data.impl.idfactories.LongIdsFactory
            + net.meisen.dissertation.data.impl.idfactories.UuIdsFactory
        -->
      <resource implementation="net.meisen.dissertation.data.impl.resources.ResourcesFactory" idfactory="net.meisen.dissertation.data.impl.idfactories.UuIdsFactory" />
      
      <!-- Define the factory used for the descriptors, available are.
           
           The following factories are available by default:
            + net.meisen.dissertation.data.impl.descriptors.DescriptorsFactory
            
           As identifier-factory the following implementations are available:
            + net.meisen.dissertation.data.impl.idfactories.IntegerIdsFactory
            + net.meisen.dissertation.data.impl.idfactories.LongIdsFactory
            + net.meisen.dissertation.data.impl.idfactories.UuIdsFactory
        -->
      <descriptor implementation="net.meisen.dissertation.data.impl.descriptors.DescriptorsFactory" idfactory="net.meisen.dissertation.data.impl.idfactories.LongIdsFactory" />
    </factories>
    
    <!-- Define a map of all the defined descriptors, by default there are some available and mapped:
          + java.lang.Double   mapped to  net.meisen.dissertation.data.impl.descriptors.DoubleDescriptor
          + java.lang.Long     mapped to  net.meisen.dissertation.data.impl.descriptors.LongDescriptor
          + java.lang.Integer  mapped to  net.meisen.dissertation.data.impl.descriptors.IntegerDescriptor
          + java.lang.Object   mapped to  net.meisen.dissertation.data.impl.descriptors.GeneralDescriptor
      -->
    <descriptors>
      <descriptor dataType="java.util.List" implementation="net.meisen.dissertation.config.xslt.mock.MyOwnTestDescriptor" />
    </descriptors>
  </config>

  <meta>
    <resources>
      <resource id="R1" name="person" />
      <resource id="R2" name="toy" />
      <resource id="R3" />
    </resources>
    <descriptors>
      <descriptor id="D1" name="funFactor" dataType="java.lang.String" />
      <descriptor id="D2" name="smiles" dataType="java.lang.Integer" />
      <descriptor id="D3" dataType="java.lang.String" />
      <descriptor id="D4" dataType="java.util.List" />
    </descriptors>
    
    <values>
      <resource model="R1" value="Philipp" />
      <resource model="R1" value="Debbie" />
      <resource model="R1" value="Edison" />
      
      <resource model="R2" value="rattle" />
      <resource model="R2" value="teddy" />
      <resource model="R2" value="cup" />
      <resource model="R2" value="doll" />

      <descriptor model="D1" value="no" />
      <descriptor model="D1" value="low" />
      <descriptor model="D1" value="average" />
      <descriptor model="D1" value="high" />
      <descriptor model="D1" value="very high" />

      <descriptor model="D2" value="1" />
      <descriptor model="D2" value="2" />
      <descriptor model="D2" value="3" />
      <descriptor model="D2" value="4" />
      <descriptor model="D2" value="5" />

      <descriptor model="D3" value="Some Value" />

      <descriptor model="D4" value="A,B,C" />
      <descriptor model="D4" value="D,E,F,G,H" />
      <descriptor model="D4" value="I" />
    </values>
  </meta>
  
  <interval granularity="net.meisen.dissertation.models.impl.granularity.rawtime.Minute" 
            naturals="net.meisen.dissertation.models.impl.naturals.IntegerNaturalsFactory"
            mapper="not.defined.Yet" />
</model>