<?xml version="1.0" encoding="UTF-8" standalone="no"?>

<model xmlns="http://dev.meisen.net/xsd/dissertation/model"
       xmlns:xsi="http://www.w3.org/2001/XMLSchema-instance"
       xsi:schemaLocation="http://dev.meisen.net/xsd/dissertation/model http://dev.meisen.net/xsd/dissertation/tidaModel.xsd">

  <meta>
    <descriptors>
      <descriptor id="D1" name="funFactor" dataType="java.lang.String" />
      <descriptor id="D2" name="smiles" dataType="java.lang.Integer" />
    </descriptors>
    
    <values>      
      <descriptor model="D1" value="no" />
      <descriptor model="D1" value="low" />
      <descriptor model="D1" value="average" />
      <descriptor model="D1" value="high" />
      <descriptor model="D1" value="very high" />
      
      <descriptor model="D2" value="1" />
      <descriptor model="D2" value="2" />
      <descriptor model="D2" value="3" />
      <descriptor model="D2" value="4" />
      <descriptor model="D2" value="5" />
    </values>
  </meta>
  
  <interval />
</model>